{
  "sub": "user-456",
  "iss": "https://identity.civitas.example/oidc",
  "aud": ["https://api.civitas.example", "https://planning.civitas.example"],
  "iat": 1785283200,
  "exp": 1785286800,
  "organization_id": "org-456",
  "https://civitas.didaxus.com/claims/organization_membership_id": "membership-456",
  "https://civitas.didaxus.com/claims/organization_role_ids": ["role-teacher", "role-reviewer"],
  "https://civitas.didaxus.com/claims/authz_contract_version": "civitas-authorization-foundation/v2"
}
